<?xml version="1.0" encoding="UTF-8"?><ESGMain xmlns:esg="urn:dvb:ipdc:esg:2005" xmlns:xsi="http://www.w3.org/2001/XMLSchema-instance" xmlns="urn:dvb:ipdc:esg:2005" xmlns:tva="urn:tva:metadata:2005" xmlns:mpeg7="urn:mpeg:mpeg7:schema:2001" xsi:schemaLocation="urn:dvb:ipdc:esg:2005 ../schemas/dvb_ipdc_esg.xsd"><CopyrightNotice>
        "supported by BBC Backstage" - http://backstage.bbc.co.uk/data/TvChannelFeeds
        This data is strictly for non-commercial use only.
        ---
        See http://backstage.bbc.co.uk/archives/2005/01/terms_of_use.html 
        for details of the terms and conditions.
      </CopyrightNotice><ESG><ContentTable><Content contentID="crid://bbc.co.uk/BBCAsiaMirrorsWorldService"><Title>BBC World Service</Title><Synopsis>The BBC Asian Network joins the BBC World Service's South Asia feed to take you through the night.</Synopsis><Genre href="urn:tva:metadata:cs:OriginationCS:2004:5.1.1"><tva:Name>Live</tva:Name></Genre><Genre href="urn:tva:metadata:cs:ContentCS:2004:3.1.1.1"><tva:Name>Daily news</tva:Name></Genre><Genre href="urn:tva:metadata:cs:ContentCS:2004:3.1.1.13"><tva:Name>Weather forecasts</tva:Name></Genre><Genre href="urn:tva:metadata:cs:FormatCS:2004:2.1.1"><tva:Name>Bulletin</tva:Name></Genre><Genre href="urn:tva:metadata:cs:IntentionCS:2004:1.2"><tva:Name>INFORMATION</tva:Name></Genre><Genre href="urn:tva:metadata:cs:ContentCS:2004:3.1.1.5"><tva:Name>Periodical/General</tva:Name></Genre><Genre href="urn:tva:metadata:cs:FormatCS:2004:2.1"><tva:Name>STRUCTURED</tva:Name></Genre></Content><Content contentID="crid://bbc.co.uk/1195396732"><Title>Devotional Sounds: Islam</Title><Synopsis>Muslim religious music with Anish Sheikh. To contact the show call 08459 440 445 [local rates]  Go to bbc.co.uk/asiannetwork for more information.</Synopsis><Genre href="urn:tva:metadata:cs:ContentCS:2004:3.1.2.1"><tva:Name>Religion</tva:Name></Genre><Genre href="urn:tva:metadata:cs:IntentionCS:2004:1.8"><tva:Name>ENRICHMENT</tva:Name></Genre><Genre href="urn:tva:metadata:cs:ContentCS:2004:3.6.9"><tva:Name>World/Traditional/Ethnic/Folk music</tva:Name></Genre><Genre href="urn:tva:metadata:cs:FormatCS:2004:2.5"><tva:Name>ARTISTIC PERFORMANCE</tva:Name></Genre><Genre href="urn:tva:metadata:cs:IntentionCS:2004:1.1"><tva:Name>ENTERTAINMENT</tva:Name></Genre></Content><Content contentID="crid://bbc.co.uk/1195396726"><Title>Devotional Sounds: Hindu</Title><Synopsis>Hindu religious music. To contact the show call 08459 440 445 [local rates]. Go to bbc.co.uk/asiannetwork for more information.</Synopsis><Genre href="urn:tva:metadata:cs:ContentCS:2004:3.1.2.1"><tva:Name>Religion</tva:Name></Genre><Genre href="urn:tva:metadata:cs:IntentionCS:2004:1.8"><tva:Name>ENRICHMENT</tva:Name></Genre><Genre href="urn:tva:metadata:cs:ContentCS:2004:3.6.9"><tva:Name>World/Traditional/Ethnic/Folk music</tva:Name></Genre><Genre href="urn:tva:metadata:cs:FormatCS:2004:2.5"><tva:Name>ARTISTIC PERFORMANCE</tva:Name></Genre><Genre href="urn:tva:metadata:cs:IntentionCS:2004:1.1"><tva:Name>ENTERTAINMENT</tva:Name></Genre></Content><Content contentID="crid://bbc.co.uk/1195396727"><Title>Devotional Sounds: Sikh</Title><Synopsis>Sikh religious music. To contact the show call 08459 440 445 [local rates]. Go to bbc.co.uk/asiannetwork for more information.</Synopsis><Genre href="urn:tva:metadata:cs:ContentCS:2004:3.1.2.1"><tva:Name>Religion</tva:Name></Genre><Genre href="urn:tva:metadata:cs:IntentionCS:2004:1.8"><tva:Name>ENRICHMENT</tva:Name></Genre><Genre href="urn:tva:metadata:cs:ContentCS:2004:3.6.9"><tva:Name>World/Traditional/Ethnic/Folk music</tva:Name></Genre><Genre href="urn:tva:metadata:cs:FormatCS:2004:2.5"><tva:Name>ARTISTIC PERFORMANCE</tva:Name></Genre><Genre href="urn:tva:metadata:cs:IntentionCS:2004:1.1"><tva:Name>ENTERTAINMENT</tva:Name></Genre></Content><Content contentID="crid://bbc.co.uk/1195396723"><Title>Hot Breakfast</Title><Synopsis>Wake up to a sizzling start to your Sunday with Mutz. To be a part of the show call now on 08459 440 445 [local rates] or go to bbc.co.uk/asiannetwork for more details.</Synopsis><Genre href="urn:tva:metadata:cs:OriginationCS:2004:5.1"><tva:Name>STUDIO</tva:Name></Genre><Genre href="urn:tva:metadata:cs:ContentCS:2004:3.1"><tva:Name>NON-FICTION</tva:Name></Genre><Genre href="urn:tva:metadata:cs:FormatCS:2004:2.1.5"><tva:Name>Discussion/Interview/Debate</tva:Name></Genre><Genre href="urn:tva:metadata:cs:IntentionCS:2004:1.1"><tva:Name>ENTERTAINMENT</tva:Name></Genre><Genre href="urn:tva:metadata:cs:ContentCS:2004:3.1.1.5"><tva:Name>Periodical/General</tva:Name></Genre><Genre href="urn:tva:metadata:cs:FormatCS:2004:2.1"><tva:Name>STRUCTURED</tva:Name></Genre><Genre href="urn:tva:metadata:cs:IntentionCS:2004:1.2"><tva:Name>INFORMATION</tva:Name></Genre></Content><Content contentID="crid://bbc.co.uk/1195396722"><Title>Sunday Soundtrack</Title><Synopsis>The top ten film soundtracks. Dance or Romance? Which do you prefer to end the show? Text your choice on 81869 [standard rates] or email sundaysoundtrack@bbc.co.uk.</Synopsis><Genre href="urn:tva:metadata:cs:OriginationCS:2004:5.1"><tva:Name>STUDIO</tva:Name></Genre><Genre href="urn:tva:metadata:cs:ContentCS:2004:3.1"><tva:Name>NON-FICTION</tva:Name></Genre><Genre href="urn:tva:metadata:cs:FormatCS:2004:2.1.5"><tva:Name>Discussion/Interview/Debate</tva:Name></Genre><Genre href="urn:tva:metadata:cs:IntentionCS:2004:1.1"><tva:Name>ENTERTAINMENT</tva:Name></Genre><Genre href="urn:tva:metadata:cs:ContentCS:2004:3.1.1.10"><tva:Name>Cultural</tva:Name></Genre></Content><Content contentID="crid://bbc.co.uk/1195396728"><Title>Breakdown</Title><Synopsis>A guide to the British Asian music scene. Send your Old Skool Anthems now. Call 08459 440 445 [local rates] or text 81869 [standard rates]. See bbc.co.uk/asiannetwork for info.</Synopsis><Genre href="urn:tva:metadata:cs:ContentCS:2004:3.6.4.1"><tva:Name>Pop</tva:Name></Genre><Genre href="urn:tva:metadata:cs:FormatCS:2004:2.5"><tva:Name>ARTISTIC PERFORMANCE</tva:Name></Genre><Genre href="urn:tva:metadata:cs:IntentionCS:2004:1.1"><tva:Name>ENTERTAINMENT</tva:Name></Genre></Content><Content contentID="crid://bbc.co.uk/1195396729"><Title>The Mix</Title><Synopsis>Two hours of non stop music with Dipps Bhamrah. The best Asian dance tracks back to back. Pick a Mix online now at bbc.co.uk/asiannetwork</Synopsis><Genre href="urn:tva:metadata:cs:ContentCS:2004:3.6.9"><tva:Name>World/Traditional/Ethnic/Folk music</tva:Name></Genre><Genre href="urn:tva:metadata:cs:FormatCS:2004:2.5"><tva:Name>ARTISTIC PERFORMANCE</tva:Name></Genre><Genre href="urn:tva:metadata:cs:IntentionCS:2004:1.1"><tva:Name>ENTERTAINMENT</tva:Name></Genre><Genre href="urn:tva:metadata:cs:OriginationCS:2004:5.1"><tva:Name>STUDIO</tva:Name></Genre><Genre href="urn:tva:metadata:cs:ContentCS:2004:3.1"><tva:Name>NON-FICTION</tva:Name></Genre><Genre href="urn:tva:metadata:cs:FormatCS:2004:2.1.5"><tva:Name>Discussion/Interview/Debate</tva:Name></Genre></Content><Content contentID="crid://bbc.co.uk/1195396733"><Title>Silver Street Omnibus</Title><Synopsis>A chance to catch up with the week's events for the residents of Silver Street, in the Asian Network's drama series.</Synopsis><Genre href="urn:tva:metadata:cs:ContentCS:2004:3.4.1"><tva:Name>General light drama</tva:Name></Genre><Genre href="urn:tva:metadata:cs:FormatCS:2004:2.2"><tva:Name>REPRESENTATION/PLAY</tva:Name></Genre><Genre href="urn:tva:metadata:cs:IntentionCS:2004:1.1"><tva:Name>ENTERTAINMENT</tva:Name></Genre></Content><Content contentID="crid://bbc.co.uk/1195396724"><Title>Old Gold</Title><Synopsis>Your weekly blast from the past with Kanwal Qazi. Contact the show on 08459 440 445 [local rates] or email oldgold@bbc.co.uk</Synopsis><Genre href="urn:tva:metadata:cs:ContentCS:2004:3.6.1"><tva:Name>Classical music</tva:Name></Genre><Genre href="urn:tva:metadata:cs:FormatCS:2004:2.5"><tva:Name>ARTISTIC PERFORMANCE</tva:Name></Genre><Genre href="urn:tva:metadata:cs:IntentionCS:2004:1.1"><tva:Name>ENTERTAINMENT</tva:Name></Genre><Genre href="urn:tva:metadata:cs:OriginationCS:2004:5.1"><tva:Name>STUDIO</tva:Name></Genre><Genre href="urn:tva:metadata:cs:ContentCS:2004:3.1"><tva:Name>NON-FICTION</tva:Name></Genre><Genre href="urn:tva:metadata:cs:FormatCS:2004:2.1.5"><tva:Name>Discussion/Interview/Debate</tva:Name></Genre></Content><Content contentID="crid://bbc.co.uk/1195396731"><Title>Weekend Mirpuri</Title><Synopsis>The best in music and entertainment in Mirpuri.</Synopsis><Genre href="urn:tva:metadata:cs:ContentCS:2004:3.6.9"><tva:Name>World/Traditional/Ethnic/Folk music</tva:Name></Genre><Genre href="urn:tva:metadata:cs:FormatCS:2004:2.5"><tva:Name>ARTISTIC PERFORMANCE</tva:Name></Genre><Genre href="urn:tva:metadata:cs:IntentionCS:2004:1.1"><tva:Name>ENTERTAINMENT</tva:Name></Genre><Genre href="urn:tva:metadata:cs:OriginationCS:2004:5.1"><tva:Name>STUDIO</tva:Name></Genre><Genre href="urn:tva:metadata:cs:ContentCS:2004:3.1"><tva:Name>NON-FICTION</tva:Name></Genre><Genre href="urn:tva:metadata:cs:FormatCS:2004:2.1.5"><tva:Name>Discussion/Interview/Debate</tva:Name></Genre></Content><Content contentID="crid://bbc.co.uk/1195396730"><Title>Weekend Bengali</Title><Synopsis>The best in music and entertainment in Bengali.</Synopsis><Genre href="urn:tva:metadata:cs:ContentCS:2004:3.6.9"><tva:Name>World/Traditional/Ethnic/Folk music</tva:Name></Genre><Genre href="urn:tva:metadata:cs:FormatCS:2004:2.5"><tva:Name>ARTISTIC PERFORMANCE</tva:Name></Genre><Genre href="urn:tva:metadata:cs:IntentionCS:2004:1.1"><tva:Name>ENTERTAINMENT</tva:Name></Genre></Content></ContentTable></ESG></ESGMain>