<?xml version="1.0" encoding="UTF-8"?><ESGMain xmlns:esg="urn:dvb:ipdc:esg:2005" xmlns:xsi="http://www.w3.org/2001/XMLSchema-instance" xmlns="urn:dvb:ipdc:esg:2005" xmlns:tva="urn:tva:metadata:2005" xmlns:mpeg7="urn:mpeg:mpeg7:schema:2001" xsi:schemaLocation="urn:dvb:ipdc:esg:2005 ../schemas/dvb_ipdc_esg.xsd"><CopyrightNotice>
        "supported by BBC Backstage" - http://backstage.bbc.co.uk/data/TvChannelFeeds
        This data is strictly for non-commercial use only.
        ---
        See http://backstage.bbc.co.uk/archives/2005/01/terms_of_use.html 
        for details of the terms and conditions.
      </CopyrightNotice><ESG><ScheduleEventTable><ScheduleEvent><PublishedStartTime>2006-01-01T02:00:00Z</PublishedStartTime><PublishedEndTime>2006-01-01T07:00:00Z</PublishedEndTime><ServiceRef IDRef="BBCSixMU"/><ContentFragmentRef IDRef="crid://bbc.co.uk/1182814502"/></ScheduleEvent><ScheduleEvent><PublishedStartTime>2006-01-01T07:00:00Z</PublishedStartTime><PublishedEndTime>2006-01-01T10:00:00Z</PublishedEndTime><ServiceRef IDRef="BBCSixMU"/><ContentFragmentRef IDRef="crid://bbc.co.uk/1182814499"/></ScheduleEvent><ScheduleEvent><PublishedStartTime>2006-01-01T10:00:00Z</PublishedStartTime><PublishedEndTime>2006-01-01T13:00:00Z</PublishedEndTime><ServiceRef IDRef="BBCSixMU"/><ContentFragmentRef IDRef="crid://bbc.co.uk/1182814498"/></ScheduleEvent><ScheduleEvent><PublishedStartTime>2006-01-01T13:00:00Z</PublishedStartTime><PublishedEndTime>2006-01-01T15:00:00Z</PublishedEndTime><ServiceRef IDRef="BBCSixMU"/><ContentFragmentRef IDRef="crid://bbc.co.uk/1182814503"/></ScheduleEvent><ScheduleEvent><PublishedStartTime>2006-01-01T15:00:00Z</PublishedStartTime><PublishedEndTime>2006-01-01T17:00:00Z</PublishedEndTime><ServiceRef IDRef="BBCSixMU"/><ContentFragmentRef IDRef="crid://bbc.co.uk/1182814497"/></ScheduleEvent><ScheduleEvent><PublishedStartTime>2006-01-01T17:00:00Z</PublishedStartTime><PublishedEndTime>2006-01-01T20:00:00Z</PublishedEndTime><ServiceRef IDRef="BBCSixMU"/><ContentFragmentRef IDRef="crid://bbc.co.uk/1182814504"/></ScheduleEvent><ScheduleEvent><PublishedStartTime>2006-01-01T20:00:00Z</PublishedStartTime><PublishedEndTime>2006-01-01T22:00:00Z</PublishedEndTime><ServiceRef IDRef="BBCSixMU"/><ContentFragmentRef IDRef="crid://bbc.co.uk/1182814501"/></ScheduleEvent><ScheduleEvent><PublishedStartTime>2006-01-01T22:00:00Z</PublishedStartTime><PublishedEndTime>2006-01-02T00:00:00Z</PublishedEndTime><ServiceRef IDRef="BBCSixMU"/><ContentFragmentRef IDRef="crid://bbc.co.uk/1182814500"/></ScheduleEvent></ScheduleEventTable></ESG></ESGMain>