<?xml version="1.0" encoding="UTF-8"?><ESGMain xmlns:esg="urn:dvb:ipdc:esg:2005" xmlns:xsi="http://www.w3.org/2001/XMLSchema-instance" xmlns="urn:dvb:ipdc:esg:2005" xmlns:tva="urn:tva:metadata:2005" xmlns:mpeg7="urn:mpeg:mpeg7:schema:2001" xsi:schemaLocation="urn:dvb:ipdc:esg:2005 ../schemas/dvb_ipdc_esg.xsd"><CopyrightNotice>
        "supported by BBC Backstage" - http://backstage.bbc.co.uk/data/TvChannelFeeds
        This data is strictly for non-commercial use only.
        ---
        See http://backstage.bbc.co.uk/archives/2005/01/terms_of_use.html 
        for details of the terms and conditions.
      </CopyrightNotice><ESG><ContentTable><Content contentID="crid://bbc.co.uk/947930824"><Title>Through the Night</Title><Synopsis>Susan Sharpe features the Lindberg brothers in concert with the Stockholm Baroque Ensemble, plus works by Castello, Mendelssohn and Sweelinck.</Synopsis><Genre href="urn:tva:metadata:cs:ContentCS:2004:3.6.1"><tva:Name>Classical music</tva:Name></Genre><Genre href="urn:tva:metadata:cs:FormatCS:2004:2.5"><tva:Name>ARTISTIC PERFORMANCE</tva:Name></Genre><Genre href="urn:tva:metadata:cs:IntentionCS:2004:1.1"><tva:Name>ENTERTAINMENT</tva:Name></Genre></Content><Content contentID="crid://bbc.co.uk/947930825"><Title>Through the Night</Title><Synopsis>Susan Sharpe features Mahler's Symphony of a thousand, plus music by Rossi, Telemann, Frescobaldi, Vartabed, Delius, Lassus and Passereau.</Synopsis><Genre href="urn:tva:metadata:cs:ContentCS:2004:3.6.1"><tva:Name>Classical music</tva:Name></Genre><Genre href="urn:tva:metadata:cs:FormatCS:2004:2.5"><tva:Name>ARTISTIC PERFORMANCE</tva:Name></Genre><Genre href="urn:tva:metadata:cs:IntentionCS:2004:1.1"><tva:Name>ENTERTAINMENT</tva:Name></Genre></Content><Content contentID="crid://bbc.co.uk/947930826"><Title>Through the Night</Title><Synopsis>Susan Sharpe continues Through the Night with music from Dalza, Vivaldi, Halvorsen, Herbert and Murray.</Synopsis><Genre href="urn:tva:metadata:cs:ContentCS:2004:3.6.1"><tva:Name>Classical music</tva:Name></Genre><Genre href="urn:tva:metadata:cs:FormatCS:2004:2.5"><tva:Name>ARTISTIC PERFORMANCE</tva:Name></Genre><Genre href="urn:tva:metadata:cs:IntentionCS:2004:1.1"><tva:Name>ENTERTAINMENT</tva:Name></Genre></Content><Content contentID="crid://bbc.co.uk/947930827"><Title>Through the Night</Title><Synopsis>Susan Sharpe concludes Through the Night with music from DÃ¼tsch, Schoenberg, Schoek, Fabritius, De Heredia, Mozart, Reger, Hoffmann and Byrd.</Synopsis><Genre href="urn:tva:metadata:cs:ContentCS:2004:3.6.1"><tva:Name>Classical music</tva:Name></Genre><Genre href="urn:tva:metadata:cs:FormatCS:2004:2.5"><tva:Name>ARTISTIC PERFORMANCE</tva:Name></Genre><Genre href="urn:tva:metadata:cs:IntentionCS:2004:1.1"><tva:Name>ENTERTAINMENT</tva:Name></Genre></Content><Content contentID="crid://bbc.co.uk/947930833"><Title>Morning on 3</Title><Synopsis>Martin Handley hosts music by Schumann, Bach/Busoni and Tchaikovsky.</Synopsis><Genre href="urn:tva:metadata:cs:ContentCS:2004:3.6.1"><tva:Name>Classical music</tva:Name></Genre><Genre href="urn:tva:metadata:cs:FormatCS:2004:2.5"><tva:Name>ARTISTIC PERFORMANCE</tva:Name></Genre><Genre href="urn:tva:metadata:cs:IntentionCS:2004:1.1"><tva:Name>ENTERTAINMENT</tva:Name></Genre></Content><Content contentID="crid://bbc.co.uk/947930832"><Title>The Cowan Collection</Title><Synopsis>Rob Cowan introduces some of his favourite recordings, including music by Rameau and Purcell. Regular features include The Innocent Ear, and Rob's recommendation for a Bargain Hunter CD.</Synopsis><Genre href="urn:tva:metadata:cs:ContentCS:2004:3.6.1"><tva:Name>Classical music</tva:Name></Genre><Genre href="urn:tva:metadata:cs:FormatCS:2004:2.5"><tva:Name>ARTISTIC PERFORMANCE</tva:Name></Genre><Genre href="urn:tva:metadata:cs:IntentionCS:2004:1.1"><tva:Name>ENTERTAINMENT</tva:Name></Genre></Content><Content contentID="crid://bbc.co.uk/947930831"><Title>Musical New Year</Title><Synopsis>An International Celebration: Rob Cowan hosts a day of special concerts from around the world to mark the arrival of 2006, starting with Vienna.</Synopsis><Genre href="urn:tva:metadata:cs:ContentCS:2004:3.6.1"><tva:Name>Classical music</tva:Name></Genre><Genre href="urn:tva:metadata:cs:FormatCS:2004:2.5"><tva:Name>ARTISTIC PERFORMANCE</tva:Name></Genre><Genre href="urn:tva:metadata:cs:IntentionCS:2004:1.1"><tva:Name>ENTERTAINMENT</tva:Name></Genre></Content><Content contentID="crid://bbc.co.uk/947930834"><Title>Musical New Year</Title><Synopsis>An International Celebration: Rob Cowan continues a day of special concerts from around the world, including Sydney, Berlin, Paris and Washington, to mark the arrival of 2006.</Synopsis><Genre href="urn:tva:metadata:cs:ContentCS:2004:3.6.1"><tva:Name>Classical music</tva:Name></Genre><Genre href="urn:tva:metadata:cs:FormatCS:2004:2.5"><tva:Name>ARTISTIC PERFORMANCE</tva:Name></Genre><Genre href="urn:tva:metadata:cs:IntentionCS:2004:1.1"><tva:Name>ENTERTAINMENT</tva:Name></Genre></Content><Content contentID="crid://bbc.co.uk/947930830"><Title>Drama on 3</Title><Synopsis>The Club, by Gregory Whitehead. At the height of the American 'Gilded Age', members of an elegant New England social and croquet club performed an elaborate if somewhat distasteful ritual.</Synopsis><Genre href="urn:tva:metadata:cs:ContentCS:2004:3.4.1"><tva:Name>General light drama</tva:Name></Genre><Genre href="urn:tva:metadata:cs:FormatCS:2004:2.2"><tva:Name>REPRESENTATION/PLAY</tva:Name></Genre><Genre href="urn:tva:metadata:cs:IntentionCS:2004:1.1"><tva:Name>ENTERTAINMENT</tva:Name></Genre></Content><Content contentID="crid://bbc.co.uk/947930829"><Title>Sunday Feature</Title><Synopsis>In Search of Hans Christian Andersen: Another chance to hear Michael Rosen and Lars Tharp's visit to Denmark to uncover the truth about the unlikely creator of some our best loved tales.</Synopsis><Genre href="urn:tva:metadata:cs:ContentCS:2004:3.6.1"><tva:Name>Classical music</tva:Name></Genre><Genre href="urn:tva:metadata:cs:FormatCS:2004:2.5"><tva:Name>ARTISTIC PERFORMANCE</tva:Name></Genre><Genre href="urn:tva:metadata:cs:IntentionCS:2004:1.1"><tva:Name>ENTERTAINMENT</tva:Name></Genre><Genre href="urn:tva:metadata:cs:ContentCS:2004:3.1"><tva:Name>NON-FICTION</tva:Name></Genre><Genre href="urn:tva:metadata:cs:FormatCS:2004:2.1.4"><tva:Name>Documentary</tva:Name></Genre><Genre href="urn:tva:metadata:cs:IntentionCS:2004:1.3"><tva:Name>EDUCATION</tva:Name></Genre></Content><Content contentID="crid://bbc.co.uk/947930828"><Title>Andy Kershaw</Title><Synopsis>Rock legend Robert Plant brings his band The Strange Sensation in to the BBC's Maida Vale studios for an exclusive session, featuring songs from their album The Mighty Rearranger.</Synopsis><Genre href="urn:tva:metadata:cs:ContentCS:2004:3.6.9"><tva:Name>World/Traditional/Ethnic/Folk music</tva:Name></Genre><Genre href="urn:tva:metadata:cs:FormatCS:2004:2.5"><tva:Name>ARTISTIC PERFORMANCE</tva:Name></Genre><Genre href="urn:tva:metadata:cs:IntentionCS:2004:1.1"><tva:Name>ENTERTAINMENT</tva:Name></Genre></Content></ContentTable></ESG></ESGMain>