<?xml version="1.0" encoding="UTF-8"?><ESGMain xmlns:esg="urn:dvb:ipdc:esg:2005" xmlns:xsi="http://www.w3.org/2001/XMLSchema-instance" xmlns="urn:dvb:ipdc:esg:2005" xmlns:tva="urn:tva:metadata:2005" xmlns:mpeg7="urn:mpeg:mpeg7:schema:2001" xsi:schemaLocation="urn:dvb:ipdc:esg:2005 ../schemas/dvb_ipdc_esg.xsd"><CopyrightNotice>
        "supported by BBC Backstage" - http://backstage.bbc.co.uk/data/TvChannelFeeds
        This data is strictly for non-commercial use only.
        ---
        See http://backstage.bbc.co.uk/archives/2005/01/terms_of_use.html 
        for details of the terms and conditions.
      </CopyrightNotice><ESG><ContentTable><Content contentID="crid://bbc.co.uk/OffAirBBCFour"><Title>This is BBC FOUR</Title><Synopsis>BBC FOUR is the BBC channel for people who want more. More depth, more range, more to stimulate the mind. More daily from 7.00pm.</Synopsis></Content><Content contentID="crid://bbc.co.uk/1103107912"><Title>James Last: Non-Stop Dancing</Title><Synopsis>James Last is one of the most successful bandleaders and arrangers in the history of popular music. He's loved by the public, why is he so often loathed by the critics?</Synopsis><Genre href="urn:tva:metadata:cs:ContentCS:2004:3.1.4"><tva:Name>Arts &amp; Media</tva:Name></Genre><Genre href="urn:tva:metadata:cs:IntentionCS:2004:1.3"><tva:Name>EDUCATION</tva:Name></Genre><Genre href="urn:tva:metadata:cs:ContentCS:2004:3.6.3.2"><tva:Name>Easy listening</tva:Name></Genre><Genre href="urn:tva:metadata:cs:ContentCS:2004:3.6.3.8"><tva:Name>Soundtrack</tva:Name></Genre><Genre href="urn:tva:metadata:cs:FormatCS:2004:2.5"><tva:Name>ARTISTIC PERFORMANCE</tva:Name></Genre><Genre href="urn:tva:metadata:cs:IntentionCS:2004:1.1"><tva:Name>ENTERTAINMENT</tva:Name></Genre></Content><Content contentID="crid://bbc.co.uk/1103108055"><Title>James Last Live in London</Title><Synopsis>London's Royal Albert Hall comes alive to the happy music sound of James Last and his orchestra. Recorded live in 1977, it's a 'non-stop party' of foot-tapping, hand-clapping, popular easy classics.</Synopsis><Genre href="urn:tva:metadata:cs:ContentCS:2004:3.6.3.2"><tva:Name>Easy listening</tva:Name></Genre><Genre href="urn:tva:metadata:cs:ContentCS:2004:3.6.3.8"><tva:Name>Soundtrack</tva:Name></Genre><Genre href="urn:tva:metadata:cs:FormatCS:2004:2.5"><tva:Name>ARTISTIC PERFORMANCE</tva:Name></Genre><Genre href="urn:tva:metadata:cs:IntentionCS:2004:1.1"><tva:Name>ENTERTAINMENT</tva:Name></Genre></Content><Content contentID="crid://bbc.co.uk/1103107913"><Title>Matt Monro: Man With the Golden Voice</Title><Synopsis>This film tells the story of the 'English Sinatra', Terry Parsons, and how he reached lofty heights from a relatively working-class background.</Synopsis><Genre href="urn:tva:metadata:cs:ContentCS:2004:3.1"><tva:Name>NON-FICTION</tva:Name></Genre><Genre href="urn:tva:metadata:cs:FormatCS:2004:2.1.4"><tva:Name>Documentary</tva:Name></Genre><Genre href="urn:tva:metadata:cs:IntentionCS:2004:1.3"><tva:Name>EDUCATION</tva:Name></Genre><Genre href="urn:tva:metadata:cs:ContentCS:2004:3.6.3.2"><tva:Name>Easy listening</tva:Name></Genre><Genre href="urn:tva:metadata:cs:ContentCS:2004:3.6.3.8"><tva:Name>Soundtrack</tva:Name></Genre><Genre href="urn:tva:metadata:cs:FormatCS:2004:2.5"><tva:Name>ARTISTIC PERFORMANCE</tva:Name></Genre><Genre href="urn:tva:metadata:cs:IntentionCS:2004:1.1"><tva:Name>ENTERTAINMENT</tva:Name></Genre></Content><Content contentID="crid://bbc.co.uk/1103107914"><Title>The World of Nat King Cole</Title><Synopsis>Home movies and rare footage help to lift some of the mystique behind the singing legend, widely regarded as one of the first global stars. [S]</Synopsis><Genre href="urn:tva:metadata:cs:ContentCS:2004:3.1.4"><tva:Name>Arts &amp; Media</tva:Name></Genre><Genre href="urn:tva:metadata:cs:IntentionCS:2004:1.3"><tva:Name>EDUCATION</tva:Name></Genre><Genre href="urn:tva:metadata:cs:ContentCS:2004:3.6.3.2"><tva:Name>Easy listening</tva:Name></Genre><Genre href="urn:tva:metadata:cs:ContentCS:2004:3.6.3.8"><tva:Name>Soundtrack</tva:Name></Genre><Genre href="urn:tva:metadata:cs:FormatCS:2004:2.5"><tva:Name>ARTISTIC PERFORMANCE</tva:Name></Genre><Genre href="urn:tva:metadata:cs:IntentionCS:2004:1.1"><tva:Name>ENTERTAINMENT</tva:Name></Genre></Content><Content contentID="crid://bbc.co.uk/1103109438"><Title>New Year's Day Concert from Vienna</Title><Synopsis>Wishing you a very Happy New Year from the Golden Concert Hall of the Musikverein in Vienna, Brian Kay presents a dazzling concert of waltzes, polkas and marches.</Synopsis><Genre href="urn:tva:metadata:cs:ContentCS:2004:3.6.1"><tva:Name>Classical music</tva:Name></Genre><Genre href="urn:tva:metadata:cs:FormatCS:2004:2.5"><tva:Name>ARTISTIC PERFORMANCE</tva:Name></Genre><Genre href="urn:tva:metadata:cs:IntentionCS:2004:1.1"><tva:Name>ENTERTAINMENT</tva:Name></Genre></Content><Content contentID="crid://bbc.co.uk/1103109432"><Title>Remember the Secret Policeman's Ball?</Title><Synopsis>Another chance to enjoy the Arena documentary that marked the 25th anniversary of Amnesty International's ground-breaking comedy show, The Secret Policeman's Ball. Strong language. [S]</Synopsis><Genre href="urn:tva:metadata:cs:ContentCS:2004:3.1.4"><tva:Name>Arts &amp; Media</tva:Name></Genre><Genre href="urn:tva:metadata:cs:IntentionCS:2004:1.3"><tva:Name>EDUCATION</tva:Name></Genre><Genre href="urn:tva:metadata:cs:ContentCS:2004:3.4.11"><tva:Name>Comedy</tva:Name></Genre><Genre href="urn:tva:metadata:cs:ContentCS:2004:3.5.7"><tva:Name>Comedy</tva:Name></Genre><Genre href="urn:tva:metadata:cs:IntentionCS:2004:1.1"><tva:Name>ENTERTAINMENT</tva:Name></Genre></Content><Content contentID="crid://bbc.co.uk/1103109433"><Title>The Quatermass Experiment</Title><Synopsis>Another chance to see this live drama first shown in July, a remake of the 50s classic which caused shockwaves across the nation. With Jason Flemyng, Adrian Dunbar, David Tennant and Mark Gatiss. [S]</Synopsis><Genre href="urn:tva:metadata:cs:ContentCS:2004:3.4.1"><tva:Name>General light drama</tva:Name></Genre><Genre href="urn:tva:metadata:cs:FormatCS:2004:2.2"><tva:Name>REPRESENTATION/PLAY</tva:Name></Genre><Genre href="urn:tva:metadata:cs:IntentionCS:2004:1.1"><tva:Name>ENTERTAINMENT</tva:Name></Genre></Content><Content contentID="crid://bbc.co.uk/1103109435"><Title>Jazz Britannia</Title><Synopsis>1/3. Stranger on the Shore: How has jazz music, a 20th century African American art form, been assimilated and interpreted by Britain, over the past 60 years? [S]</Synopsis><Genre href="urn:tva:metadata:cs:ContentCS:2004:3.6.2"><tva:Name>Jazz</tva:Name></Genre><Genre href="urn:tva:metadata:cs:FormatCS:2004:2.5"><tva:Name>ARTISTIC PERFORMANCE</tva:Name></Genre><Genre href="urn:tva:metadata:cs:IntentionCS:2004:1.1"><tva:Name>ENTERTAINMENT</tva:Name></Genre><Genre href="urn:tva:metadata:cs:ContentCS:2004:3.1"><tva:Name>NON-FICTION</tva:Name></Genre><Genre href="urn:tva:metadata:cs:FormatCS:2004:2.1.4"><tva:Name>Documentary</tva:Name></Genre><Genre href="urn:tva:metadata:cs:IntentionCS:2004:1.3"><tva:Name>EDUCATION</tva:Name></Genre></Content></ContentTable></ESG></ESGMain>