<?xml version="1.0" encoding="UTF-8"?><ESGMain xmlns:esg="urn:dvb:ipdc:esg:2005" xmlns:xsi="http://www.w3.org/2001/XMLSchema-instance" xmlns="urn:dvb:ipdc:esg:2005" xmlns:tva="urn:tva:metadata:2005" xmlns:mpeg7="urn:mpeg:mpeg7:schema:2001" xsi:schemaLocation="urn:dvb:ipdc:esg:2005 ../schemas/dvb_ipdc_esg.xsd"><CopyrightNotice>
        "supported by BBC Backstage" - http://backstage.bbc.co.uk/data/TvChannelFeeds
        This data is strictly for non-commercial use only.
        ---
        See http://backstage.bbc.co.uk/archives/2005/01/terms_of_use.html 
        for details of the terms and conditions.
      </CopyrightNotice><ESG><ContentTable><Content contentID="crid://bbc.co.uk/1178617029"><Title>On Sports Extra This Month...</Title><Synopsis>Sports Extra Football: Coming up on Monday at 2.55pm, uninterrupted live commentary on one of the afternoon's top matches in the Premier League. Go to bbc.co.uk/sportsextra for more info.</Synopsis></Content><Content contentID="crid://bbc.co.uk/1178617031"><Title>On Sports Extra This Month...</Title><Synopsis>Sports Extra Football: Coming up on Monday at 2.55pm, uninterrupted live commentary on one of the afternoon's top matches in the Premier League. Go to bbc.co.uk/sportsextra for more info.</Synopsis></Content><Content contentID="crid://bbc.co.uk/1178617028"><Title>On Sports Extra This Month...</Title><Synopsis>Sports Extra Football: Coming up on Monday at 2.55pm, uninterrupted live commentary on one of the afternoon's top matches in the Premier League. Go to bbc.co.uk/sportsextra for more info.</Synopsis></Content><Content contentID="crid://bbc.co.uk/1178617030"><Title>On Sports Extra This Month...</Title><Synopsis>Sports Extra Football: Coming up on Monday at 2.55pm, uninterrupted live commentary on one of the afternoon's top matches in the Premier League. Go to bbc.co.uk/sportsextra for more info.</Synopsis></Content></ContentTable></ESG></ESGMain>